{
  "slots": [
    {
      "cMember": "hxc_interface_slot_CounterView_doubled",
      "id": "interface-slot.CounterView.doubled",
      "ownerInstanceId": "instance.interface.2930f20fd8651d0973dc4eca05b9816cb3060a9477306e517f4e3bc8f5e36afc",
      "returnRepresentation": "i32",
      "parameterRepresentations": []
    },
    {
      "cMember": "hxc_interface_slot_CounterView_read",
      "id": "interface-slot.CounterView.read",
      "ownerInstanceId": "instance.interface.2930f20fd8651d0973dc4eca05b9816cb3060a9477306e517f4e3bc8f5e36afc",
      "returnRepresentation": "i32",
      "parameterRepresentations": [
        "i32"
      ]
    },
    {
      "cMember": "hxc_interface_slot_ReadableView_read",
      "id": "interface-slot.ReadableView.read",
      "ownerInstanceId": "instance.interface.af1267a3848fffdcced950c680bb0feb780a1916fade8461036dc64c3b24443f",
      "returnRepresentation": "i32",
      "parameterRepresentations": [
        "i32"
      ]
    },
    {
      "cMember": "hxc_interface_slot_ResetView_resetValue",
      "id": "interface-slot.ResetView.resetValue",
      "ownerInstanceId": "instance.interface.b93487e9aaad33ad71972b061c3d8633d3f3e104f738c6da257d9645b887ae34",
      "returnRepresentation": "i32",
      "parameterRepresentations": []
    }
  ],
  "status": "analyzed-reachable-instance-dispatch",
  "schemaVersion": 2,
  "tables": [
    {
      "entries": [
        {
          "adapterCName": "hxc_compiler_virtual_dispatch_thunk_interface_slot_CounterView_doubled_method_AlternateCounter_doubled",
          "implementationFunctionId": "method.AlternateCounter.doubled",
          "slotId": "interface-slot.CounterView.doubled"
        },
        {
          "adapterCName": "hxc_compiler_virtual_dispatch_thunk_interface_slot_CounterView_read_method_AlternateCounter_read",
          "implementationFunctionId": "method.AlternateCounter.read",
          "slotId": "interface-slot.CounterView.read"
        }
      ],
      "layoutId": "itable.layout.CounterView",
      "classInstanceId": "instance.class.f170ae38c39850785f44a8b3f46c577aaf62775f462c81e7ceb746fff748fa70",
      "cName": "hxc_itable_compiler_interface_dispatch_AlternateCounter_itable_layout_CounterView",
      "id": "itable.AlternateCounter.CounterView"
    },
    {
      "entries": [
        {
          "adapterCName": "hxc_compiler_virtual_dispatch_thunk_interface_slot_ReadableView_read_method_AlternateCounter_read",
          "implementationFunctionId": "method.AlternateCounter.read",
          "slotId": "interface-slot.ReadableView.read"
        }
      ],
      "layoutId": "itable.layout.ReadableView",
      "classInstanceId": "instance.class.f170ae38c39850785f44a8b3f46c577aaf62775f462c81e7ceb746fff748fa70",
      "cName": "hxc_itable_compiler_interface_dispatch_AlternateCounter_itable_layout_ReadableView",
      "id": "itable.AlternateCounter.ReadableView"
    },
    {
      "entries": [
        {
          "adapterCName": "hxc_compiler_virtual_dispatch_thunk_interface_slot_CounterView_doubled_method_Counter_doubled",
          "implementationFunctionId": "method.Counter.doubled",
          "slotId": "interface-slot.CounterView.doubled"
        },
        {
          "adapterCName": "hxc_compiler_virtual_dispatch_thunk_interface_slot_CounterView_read_method_Counter_read",
          "implementationFunctionId": "method.Counter.read",
          "slotId": "interface-slot.CounterView.read"
        }
      ],
      "layoutId": "itable.layout.CounterView",
      "classInstanceId": "instance.class.e888477ae6b335d3e298cdf3d314d6ee439bbf3ad2634e5e6227184490d1f2c8",
      "cName": "hxc_itable_compiler_interface_dispatch_Counter_itable_layout_CounterView",
      "id": "itable.Counter.CounterView"
    },
    {
      "entries": [
        {
          "adapterCName": "hxc_compiler_virtual_dispatch_thunk_interface_slot_ReadableView_read_method_Counter_read",
          "implementationFunctionId": "method.Counter.read",
          "slotId": "interface-slot.ReadableView.read"
        }
      ],
      "layoutId": "itable.layout.ReadableView",
      "classInstanceId": "instance.class.e888477ae6b335d3e298cdf3d314d6ee439bbf3ad2634e5e6227184490d1f2c8",
      "cName": "hxc_itable_compiler_interface_dispatch_Counter_itable_layout_ReadableView",
      "id": "itable.Counter.ReadableView"
    },
    {
      "entries": [
        {
          "adapterCName": "hxc_compiler_virtual_dispatch_thunk_interface_slot_ResetView_resetValue_method_Counter_resetValue",
          "implementationFunctionId": "method.Counter.resetValue",
          "slotId": "interface-slot.ResetView.resetValue"
        }
      ],
      "layoutId": "itable.layout.ResetView",
      "classInstanceId": "instance.class.e888477ae6b335d3e298cdf3d314d6ee439bbf3ad2634e5e6227184490d1f2c8",
      "cName": "hxc_itable_compiler_interface_dispatch_Counter_itable_layout_ResetView",
      "id": "itable.Counter.ResetView"
    }
  ],
  "adapterPolicy": "representation-identical-overrides-with-typed-receiver-thunks",
  "runtimeFeatures": [],
  "tablePolicy": "reachable-class-vtables-and-per-interface-itables-only",
  "calls": [
    {
      "methodFunctionId": "method.ReadableView.read",
      "callerFunctionId": "function.Main.inspect",
      "id": "dispatch.call.0",
      "reason": "ordinary-interface-method",
      "receiverStaticClass": "ReadableView",
      "slotId": "interface-slot.ReadableView.read",
      "targetFunctionId": null,
      "dispatch": "interface",
      "source": {
        "startLine": 13,
        "file": "Main.hx",
        "startColumn": 10,
        "endLine": 13,
        "endColumn": 26
      }
    },
    {
      "methodFunctionId": "method.ReadableView.read",
      "callerFunctionId": "function.Main.main",
      "id": "dispatch.call.1",
      "reason": "ordinary-interface-method",
      "receiverStaticClass": "CounterView",
      "slotId": "interface-slot.CounterView.read",
      "targetFunctionId": null,
      "dispatch": "interface",
      "source": {
        "startLine": 23,
        "file": "Main.hx",
        "startColumn": 10,
        "endLine": 23,
        "endColumn": 25
      }
    },
    {
      "methodFunctionId": "method.CounterView.doubled",
      "callerFunctionId": "function.Main.main",
      "id": "dispatch.call.2",
      "reason": "ordinary-interface-method",
      "receiverStaticClass": "CounterView",
      "slotId": "interface-slot.CounterView.doubled",
      "targetFunctionId": null,
      "dispatch": "interface",
      "source": {
        "startLine": 23,
        "file": "Main.hx",
        "startColumn": 35,
        "endLine": 23,
        "endColumn": 52
      }
    },
    {
      "methodFunctionId": "method.ReadableView.read",
      "callerFunctionId": "function.Main.main",
      "id": "dispatch.call.3",
      "reason": "ordinary-interface-method",
      "receiverStaticClass": "CounterView",
      "slotId": "interface-slot.CounterView.read",
      "targetFunctionId": null,
      "dispatch": "interface",
      "source": {
        "startLine": 23,
        "file": "Main.hx",
        "startColumn": 62,
        "endLine": 23,
        "endColumn": 77
      }
    },
    {
      "methodFunctionId": "method.ResetView.resetValue",
      "callerFunctionId": "function.Main.main",
      "id": "dispatch.call.4",
      "reason": "ordinary-interface-method",
      "receiverStaticClass": "ResetView",
      "slotId": "interface-slot.ResetView.resetValue",
      "targetFunctionId": null,
      "dispatch": "interface",
      "source": {
        "startLine": 23,
        "file": "Main.hx",
        "startColumn": 87,
        "endLine": 23,
        "endColumn": 105
      }
    }
  ],
  "layouts": [
    {
      "cTag": "hxc_compiler_interface_dispatch_CounterView_table_layout",
      "id": "itable.layout.CounterView",
      "slotIds": [
        "interface-slot.CounterView.doubled",
        "interface-slot.CounterView.read"
      ],
      "rootInstanceId": "instance.interface.2930f20fd8651d0973dc4eca05b9816cb3060a9477306e517f4e3bc8f5e36afc"
    },
    {
      "cTag": "hxc_compiler_interface_dispatch_ReadableView_table_layout",
      "id": "itable.layout.ReadableView",
      "slotIds": [
        "interface-slot.ReadableView.read"
      ],
      "rootInstanceId": "instance.interface.af1267a3848fffdcced950c680bb0feb780a1916fade8461036dc64c3b24443f"
    },
    {
      "cTag": "hxc_compiler_interface_dispatch_ResetView_table_layout",
      "id": "itable.layout.ResetView",
      "slotIds": [
        "interface-slot.ResetView.resetValue"
      ],
      "rootInstanceId": "instance.interface.b93487e9aaad33ad71972b061c3d8633d3f3e104f738c6da257d9645b887ae34"
    }
  ],
  "summary": {
    "indirectCalls": 5,
    "slots": 4,
    "instanceCalls": 5,
    "tables": 5,
    "directCalls": 0,
    "adapters": 7,
    "layouts": 3
  },
  "algorithm": "hxc-closed-world-instance-dispatch-v2"
}
